<?xml version="1.0" encoding="utf-8" ?>
<Datatable xmlns:xsi="http://www.w3.org/2001/XMLSchema-instance" xmlns:xsd="http://www.w3.org/2001/XMLSchema" xsi:noNamespaceSchemaLocation="../Schemas/MinorStateDefinition.xsd">

    <!--TODO: OVERALL: change Pirates ship to corresponding faction ships-->
    <!--TODO: add granularity to each MF family in fleet mission composition-->
    
    <!-- ######################################################################## -->
    <!-- #################### NON WARMONGER MINOR FACTIONS     ################## -->
    <!-- ######################################################################## -->     
    
    <!--Pacifists, Idle on Systems-->
    <!--State 1-->
    <MinorStateDefinition Name="InactivePacifist" MinimumStress="0">
        <PathPrerequisite Flags="Prerequisite">PersonalityTraitPacifist</PathPrerequisite>
        <FleetMissions>
            <FleetMission Weight="1">
                <!--Defend Mission-->
                <FleetMissionReference Name="DefendSystemIdle"/>
                <!--Pirates-->
                <FleetComposition>
                    <PathPrerequisite Flags="Prerequisite">FamilyPirates,MinorFactionDifficultyEasy</PathPrerequisite>
                    <NeededShips>
                        <ShipDesign Name="MinorFactionScavengerSmallAttackWeak"/>
                    </NeededShips>
                </FleetComposition>
                <FleetComposition>
                    <PathPrerequisite Flags="Prerequisite">FamilyPirates,MinorFactionDifficultyNormal</PathPrerequisite>
                    <NeededShips>
                        <ShipDesign Name="MinorFactionScavengerSmallAttackWeak"/>
                        <ShipDesign Name="MinorFactionScavengerSmallAttackWeak"/>
                    </NeededShips>
                </FleetComposition>
                <FleetComposition>
                    <PathPrerequisite Flags="Prerequisite">FamilyPirates,MinorFactionDifficultyHard</PathPrerequisite>
                    <NeededShips>
                        <ShipDesign Name="MinorFactionScavengerSmallAttackWeak"/>
                        <ShipDesign Name="MinorFactionScavengerSmallAttackAvg"/>
                        <ShipDesign Name="MinorFactionScavengerSmallAttackAvg"/>
                    </NeededShips>
                </FleetComposition>
                <!--Insectoids-->
                <FleetComposition>
                    <PathPrerequisite Flags="Prerequisite">FamilyInsectoids,MinorFactionDifficultyEasy</PathPrerequisite>
                    <NeededShips>
                        <ShipDesign Name="MinorFactionInsectoidSmallAttackWeak"/>
                    </NeededShips>
                </FleetComposition>
                <FleetComposition>
                    <PathPrerequisite Flags="Prerequisite">FamilyInsectoids,MinorFactionDifficultyNormal</PathPrerequisite>
                    <NeededShips>
                        <ShipDesign Name="MinorFactionInsectoidSmallAttackWeak"/>
                        <ShipDesign Name="MinorFactionInsectoidSmallAttackWeak"/>
                    </NeededShips>
                </FleetComposition>
                <FleetComposition>
                    <PathPrerequisite Flags="Prerequisite">FamilyInsectoids,MinorFactionDifficultyHard</PathPrerequisite>
                    <NeededShips>
                        <ShipDesign Name="MinorFactionInsectoidSmallAttackWeak"/>
                        <ShipDesign Name="MinorFactionInsectoidSmallAttackAvg"/>
                        <ShipDesign Name="MinorFactionInsectoidSmallAttackAvg"/>
                    </NeededShips>
                </FleetComposition>
                <!--Primitive-->
                <FleetComposition>
                    <PathPrerequisite Flags="Prerequisite">FamilyPrimitives,MinorFactionDifficultyEasy</PathPrerequisite>
                    <NeededShips>
                        <ShipDesign Name="MinorFactionPrimitiveSmallAttackWeak"/>
                    </NeededShips>
                </FleetComposition>
                <FleetComposition>
                    <PathPrerequisite Flags="Prerequisite">FamilyPrimitives,MinorFactionDifficultyNormal</PathPrerequisite>
                    <NeededShips>
                        <ShipDesign Name="MinorFactionPrimitiveSmallAttackWeak"/>
                        <ShipDesign Name="MinorFactionPrimitiveSmallAttackWeak"/>
                    </NeededShips>
                </FleetComposition>
                <FleetComposition>
                    <PathPrerequisite Flags="Prerequisite">FamilyPrimitives,MinorFactionDifficultyHard</PathPrerequisite>
                    <NeededShips>
                        <ShipDesign Name="MinorFactionPrimitiveSmallAttackWeak"/>
                        <ShipDesign Name="MinorFactionPrimitiveSmallAttackAvg"/>
                        <ShipDesign Name="MinorFactionPrimitiveSmallAttackAvg"/>
                    </NeededShips>
                </FleetComposition>
                <!--Advanced-->
                <FleetComposition>
                    <PathPrerequisite Flags="Prerequisite">FamilyAdvanced,MinorFactionDifficultyEasy</PathPrerequisite>
                    <NeededShips>
                        <ShipDesign Name="MinorFactionAdvancedSmallAttackWeak"/>
                    </NeededShips>
                </FleetComposition>
                <FleetComposition>
                    <PathPrerequisite Flags="Prerequisite">FamilyAdvanced,MinorFactionDifficultyNormal</PathPrerequisite>
                    <NeededShips>
                        <ShipDesign Name="MinorFactionAdvancedSmallAttackWeak"/>
                        <ShipDesign Name="MinorFactionAdvancedSmallAttackWeak"/>
                    </NeededShips>
                </FleetComposition>
                <FleetComposition>
                    <PathPrerequisite Flags="Prerequisite">FamilyAdvanced,MinorFactionDifficultyHard</PathPrerequisite>
                    <NeededShips>
                        <ShipDesign Name="MinorFactionAdvancedSmallAttackWeak"/>
                        <ShipDesign Name="MinorFactionAdvancedSmallAttackAvg"/>
                        <ShipDesign Name="MinorFactionAdvancedSmallAttackAvg"/>
                    </NeededShips>
                </FleetComposition>
            </FleetMission>
        </FleetMissions>
        <SimulationDescriptorReference Name="MinorResourceDistributionInactive"/>
    </MinorStateDefinition>
    <!--State 2-->
    <MinorStateDefinition Name="PassivePacifist" MinimumStress="7">
        <PathPrerequisite Flags="Prerequisite">PersonalityTraitPacifist</PathPrerequisite>
        <DefaultFleetMissionReference Name="DefendSystemIdle"/>
        <FleetMissions>
          <FleetMission Weight="1">
                <!--Defend Mission-->
                <FleetMissionReference Name="DefendSystemIdle"/>
                <!--Pirates-->
                <FleetComposition>
                  <PathPrerequisite Flags="Prerequisite">FamilyPirates,MinorFactionDifficultyEasy</PathPrerequisite>
                  <NeededShips>
                      <ShipDesign Name="MinorFactionScavengerSmallAttackWeak"/>
                  </NeededShips>
              </FleetComposition>
                <FleetComposition>
                    <PathPrerequisite Flags="Prerequisite">FamilyPirates,MinorFactionDifficultyNormal</PathPrerequisite>
                    <NeededShips>
                        <ShipDesign Name="MinorFactionScavengerSmallAttackWeak"/>
                        <ShipDesign Name="MinorFactionScavengerSmallAttackWeak"/>
                    </NeededShips>
                </FleetComposition>
                <FleetComposition>
                    <PathPrerequisite Flags="Prerequisite">FamilyPirates,MinorFactionDifficultyHard</PathPrerequisite>
                    <NeededShips>
                        <ShipDesign Name="MinorFactionScavengerSmallAttackWeak"/>
                        <ShipDesign Name="MinorFactionScavengerSmallAttackWeak"/>
                        <ShipDesign Name="MinorFactionScavengerSmallAttackAvg"/>
                        <ShipDesign Name="MinorFactionScavengerSmallAttackAvg"/>
                    </NeededShips>
                </FleetComposition>
                <!--Insectoids-->
                <FleetComposition>
                    <PathPrerequisite Flags="Prerequisite">FamilyInsectoids,MinorFactionDifficultyEasy</PathPrerequisite>
                    <NeededShips>
                        <ShipDesign Name="MinorFactionInsectoidSmallAttackWeak"/>
                    </NeededShips>
                </FleetComposition>
                <FleetComposition>
                  <PathPrerequisite Flags="Prerequisite">FamilyInsectoids,MinorFactionDifficultyNormal</PathPrerequisite>
                  <NeededShips>
                      <ShipDesign Name="MinorFactionInsectoidSmallAttackWeak"/>
                      <ShipDesign Name="MinorFactionInsectoidSmallAttackWeak"/>
                  </NeededShips>
                </FleetComposition>
                <FleetComposition>
                    <PathPrerequisite Flags="Prerequisite">FamilyInsectoids,MinorFactionDifficultyHard</PathPrerequisite>
                    <NeededShips>
                        <ShipDesign Name="MinorFactionInsectoidSmallAttackWeak"/>
                        <ShipDesign Name="MinorFactionInsectoidSmallAttackWeak"/>
                        <ShipDesign Name="MinorFactionInsectoidSmallAttackAvg"/>
                        <ShipDesign Name="MinorFactionInsectoidSmallAttackAvg"/>
                    </NeededShips>
                </FleetComposition>
                <!--Primitive-->
                <FleetComposition>
                    <PathPrerequisite Flags="Prerequisite">FamilyPrimitives,MinorFactionDifficultyEasy</PathPrerequisite>
                    <NeededShips>
                        <ShipDesign Name="MinorFactionPrimitiveSmallAttackWeak"/>
                    </NeededShips>
                </FleetComposition>
                <FleetComposition>